{
  "spec_version": "0.1",
  "bundle_id": "bundle-example-001",
  "created_at": "2026-10-02T15:01:00Z",
  "producer_version": "0.1.0-design-fixture",
  "target": {
    "kind": "service",
    "id": "order-entry",
    "environment": "test"
  },
  "run_ids": [
    "run-example-001"
  ],
  "complete": false,
  "limitations": [
    "Synthetic fixture; no live observation"
  ],
  "sources": [
    {
      "reference": "fixture:command-output",
      "observed_at": "2026-10-02T15:00:00Z",
      "evidence_state": "sourced",
      "untrusted": true
    }
  ],
  "artifacts": [
    {
      "path": "results/command.json",
      "media_type": "application/json",
      "bytes": 100,
      "digest": "sha256:0000000000000000000000000000000000000000000000000000000000000000",
      "classification": "internal"
    }
  ],
  "classification": "internal"
}
